{
  "schema" : "vlm.request.v1",
  "doc_sha256" : "4098b6818705feb049d4a1c8ee3beaec4afba1c494cf4a200c034be4673326eb",
  "image_path" : "\/Users\/jryear\/Desktop\/NativeOCR\/runs\/vlm\/4098b6818705feb049d4a1c8ee3beaec4afba1c494cf4a200c034be4673326eb_p0_roi0.png",
  "roi" : {
    "px" : 0,
    "pw" : 2533,
    "ph" : 3225,
    "py" : 0
  },
  "hints" : {
    "columns_est" : 2,
    "binarize" : 0,
    "est_cells" : 16,
    "paragraph_median_conf" : 0.34038472175598145,
    "numeric_density" : 0.2604166666666667,
    "est_rows" : 8,
    "est_cols" : 2,
    "script_conflict_rate" : 0,
    "deskew_deg" : 0,
    "budget_class_idx" : 0
  },
  "roi_id" : "page",
  "page_index" : 0
}