{
  "page_index" : 0,
  "schema" : "vlm.request.v1",
  "hints" : {
    "binarize" : 0,
    "numeric_density" : 0.5886699507389163,
    "deskew_deg" : 0,
    "columns_est" : 6,
    "script_conflict_rate" : 0.2248062015503876
  },
  "roi" : {
    "ph" : 774,
    "py" : 0,
    "px" : 0,
    "pw" : 608
  },
  "doc_sha256" : "4098b6818705feb049d4a1c8ee3beaec4afba1c494cf4a200c034be4673326eb",
  "image_path" : "\/Users\/jryear\/Desktop\/NativeOCR\/runs\/smoke_vlm\/4098b6818705feb049d4a1c8ee3beaec4afba1c494cf4a200c034be4673326eb_p0_roi0_pre.png",
  "roi_id" : "page"
}